{
  "baseDomain": "127.0.0.1",
  "crawlMeta": {
    "durationMs": 18,
    "errorCount": 0,
    "maxDepth": 3,
    "maxPages": null,
    "pageCount": 7
  },
  "generatedAt": "2026-08-31T01:40:25.669Z",
  "nodes": {
    "http://127.0.0.1:8787/": {
      "children": [
        "http://127.0.0.1:8787/a",
        "http://127.0.0.1:8787/b",
        "http://127.0.0.1:8787/about",
        "http://127.0.0.1:8787/"
      ],
      "contentType": "text/html;charset=utf-8",
      "depth": 0,
      "discoveredAt": "2026-08-31T01:40:25.676Z",
      "error": null,
      "parents": [
        "http://127.0.0.1:8787/",
        "http://127.0.0.1:8787/a",
        "http://127.0.0.1:8787/b",
        "http://127.0.0.1:8787/about"
      ],
      "path": "/",
      "status": 200,
      "title": "Fixture Site — Home",
      "url": "http://127.0.0.1:8787/"
    },
    "http://127.0.0.1:8787/a": {
      "children": [
        "http://127.0.0.1:8787/",
        "http://127.0.0.1:8787/a/1"
      ],
      "contentType": "text/html;charset=utf-8",
      "depth": 1,
      "discoveredAt": "2026-08-31T01:40:25.680Z",
      "error": null,
      "parents": [
        "http://127.0.0.1:8787/",
        "http://127.0.0.1:8787/a/1"
      ],
      "path": "/a",
      "status": 200,
      "title": "Section A",
      "url": "http://127.0.0.1:8787/a"
    },
    "http://127.0.0.1:8787/a/1": {
      "children": [
        "http://127.0.0.1:8787/a"
      ],
      "contentType": "text/html;charset=utf-8",
      "depth": 2,
      "discoveredAt": "2026-08-31T01:40:25.688Z",
      "error": null,
      "parents": [
        "http://127.0.0.1:8787/a"
      ],
      "path": "/a/1",
      "status": 200,
      "title": "A / 1",
      "url": "http://127.0.0.1:8787/a/1"
    },
    "http://127.0.0.1:8787/about": {
      "children": [
        "http://127.0.0.1:8787/"
      ],
      "contentType": "text/html;charset=utf-8",
      "depth": 1,
      "discoveredAt": "2026-08-31T01:40:25.685Z",
      "error": null,
      "parents": [
        "http://127.0.0.1:8787/"
      ],
      "path": "/about",
      "status": 200,
      "title": "About",
      "url": "http://127.0.0.1:8787/about"
    },
    "http://127.0.0.1:8787/b": {
      "children": [
        "http://127.0.0.1:8787/",
        "http://127.0.0.1:8787/b/1",
        "http://127.0.0.1:8787/b/2"
      ],
      "contentType": "text/html;charset=utf-8",
      "depth": 1,
      "discoveredAt": "2026-08-31T01:40:25.683Z",
      "error": null,
      "parents": [
        "http://127.0.0.1:8787/",
        "http://127.0.0.1:8787/b/1"
      ],
      "path": "/b",
      "status": 200,
      "title": "Section B",
      "url": "http://127.0.0.1:8787/b"
    },
    "http://127.0.0.1:8787/b/1": {
      "children": [
        "http://127.0.0.1:8787/b",
        "http://127.0.0.1:8787/b/2"
      ],
      "contentType": "text/html;charset=utf-8",
      "depth": 2,
      "discoveredAt": "2026-08-31T01:40:25.690Z",
      "error": null,
      "parents": [
        "http://127.0.0.1:8787/b",
        "http://127.0.0.1:8787/b/2"
      ],
      "path": "/b/1",
      "status": 200,
      "title": "B / 1",
      "url": "http://127.0.0.1:8787/b/1"
    },
    "http://127.0.0.1:8787/b/2": {
      "children": [
        "http://127.0.0.1:8787/b/1"
      ],
      "contentType": "text/html;charset=utf-8",
      "depth": 2,
      "discoveredAt": "2026-08-31T01:40:25.691Z",
      "error": null,
      "parents": [
        "http://127.0.0.1:8787/b",
        "http://127.0.0.1:8787/b/1"
      ],
      "path": "/b/2",
      "status": 200,
      "title": "B / 2",
      "url": "http://127.0.0.1:8787/b/2"
    }
  },
  "startUrl": "http://127.0.0.1:8787/"
}
